<?xml version="1.0" encoding="UTF-8"?>
<xs:schema xmlns:tns="http://mapsforge.org/renderTheme" xmlns:xs="http://www.w3.org/2001/XMLSchema" elementFormDefault="qualified" targetNamespace="http://mapsforge.org/renderTheme" xml:lang="en">

    <!-- attribute types -->
    <xs:simpleType name="cap">
        <xs:restriction base="xs:string">
            <xs:enumeration value="butt" />
            <xs:enumeration value="round" />
            <xs:enumeration value="square" />
        </xs:restriction>
    </xs:simpleType>

    <xs:simpleType name="position">
        <xs:restriction base="xs:string">
            <xs:enumeration value="auto" />
            <xs:enumeration value="center" />
            <xs:enumeration value="below" />
            <xs:enumeration value="below_left" />
            <xs:enumeration value="below_right" />
            <xs:enumeration value="above" />
            <xs:enumeration value="above_left" />
            <xs:enumeration value="above_right" />
            <xs:enumeration value="left" />
            <xs:enumeration value="right" />
        </xs:restriction>
    </xs:simpleType>

    <xs:simpleType name="closed">
        <xs:restriction base="xs:string">
            <xs:enumeration value="yes" />
            <xs:enumeration value="no" />
            <xs:enumeration value="any" />
        </xs:restriction>
    </xs:simpleType>

    <xs:simpleType name="color">
        <xs:annotation>
            <xs:documentation>Supported formats are #RRGGBB and #AARRGGBB.</xs:documentation>
        </xs:annotation>
        <xs:restriction base="xs:string">
            <xs:pattern value="#([0-9a-fA-F]{6}|[0-9a-fA-F]{8})" />
        </xs:restriction>
    </xs:simpleType>

    <xs:simpleType name="curve">
        <xs:restriction base="xs:string">
            <xs:enumeration value="cubic" />
            <xs:enumeration value="no" />
        </xs:restriction>
    </xs:simpleType>

    <xs:simpleType name="display">
        <xs:restriction base="xs:string">
            <xs:enumeration value="never" />
            <xs:enumeration value="ifspace" />
            <xs:enumeration value="order" />
            <xs:enumeration value="always" />
        </xs:restriction>
    </xs:simpleType>

    <xs:simpleType name="elementList">
        <xs:restriction base="xs:string">
            <xs:enumeration value="node" />
            <xs:enumeration value="way" />
            <xs:enumeration value="any" />
        </xs:restriction>
    </xs:simpleType>

    <xs:simpleType name="fontFamily">
        <xs:restriction base="xs:string">
            <xs:enumeration value="default" />
            <xs:enumeration value="monospace" />
            <xs:enumeration value="sans_serif" />
            <xs:enumeration value="serif" />
        </xs:restriction>
    </xs:simpleType>

    <xs:simpleType name="fontStyle">
        <xs:restriction base="xs:string">
            <xs:enumeration value="bold" />
            <xs:enumeration value="bold_italic" />
            <xs:enumeration value="italic" />
            <xs:enumeration value="normal" />
        </xs:restriction>
    </xs:simpleType>

    <xs:simpleType name="linejoin">
        <xs:restriction base="xs:string">
            <xs:enumeration value="miter" />
            <xs:enumeration value="round" />
            <xs:enumeration value="bevel" />
        </xs:restriction>
    </xs:simpleType>

    <xs:simpleType name="nonNegativeFloat">
        <xs:restriction base="xs:float">
            <xs:minInclusive value="0" />
        </xs:restriction>
    </xs:simpleType>

    <xs:simpleType name="scale">
        <xs:restriction base="xs:string">
            <xs:enumeration value="all" />
            <xs:enumeration value="none" />
            <xs:enumeration value="stroke" />
        </xs:restriction>
    </xs:simpleType>

    <xs:simpleType name="src">
        <xs:restriction base="xs:string">
            <xs:pattern value="((jar|file|assets):)?.+" />
        </xs:restriction>
    </xs:simpleType>

    <xs:simpleType name="strokeDasharray">
        <xs:restriction base="xs:string">
            <xs:pattern value="([0-9]+(\.[0-9]+)? *, *[0-9]+(\.[0-9]+)? *, *)*[0-9]+(\.[0-9]+)? *, *[0-9]+(\.[0-9]+)?" />
        </xs:restriction>
    </xs:simpleType>

    <xs:simpleType name="symbolOrientation">
        <xs:restriction base="xs:string">
            <xs:enumeration value="auto" />
            <xs:enumeration value="auto_down" />
            <xs:enumeration value="right" />
            <xs:enumeration value="left" />
            <xs:enumeration value="up" />
            <xs:enumeration value="down" />
        </xs:restriction>
    </xs:simpleType>

    <xs:simpleType name="textOrientation">
        <xs:restriction base="xs:string">
            <xs:enumeration value="auto" />
            <xs:enumeration value="auto_down" />
            <xs:enumeration value="right" />
            <xs:enumeration value="left" />
        </xs:restriction>
    </xs:simpleType>

    <xs:simpleType name="textTransform">
        <xs:restriction base="xs:string">
            <xs:enumeration value="none" />
            <xs:enumeration value="uppercase" />
            <xs:enumeration value="lowercase" />
            <xs:enumeration value="capitalize" />
        </xs:restriction>
    </xs:simpleType>

    <xs:complexType name="area">
        <xs:attribute name="cat" type="xs:string" use="optional" />
        <xs:attribute name="src" type="tns:src" use="optional" />
        <xs:attribute name="symbol-width" type="xs:positiveInteger" use="optional" />
        <xs:attribute name="symbol-height" type="xs:positiveInteger" use="optional" />
        <xs:attribute name="symbol-percent" type="xs:positiveInteger" use="optional" />
        <xs:attribute name="fill" default="#000000" type="tns:color" use="optional" />
        <xs:attribute name="scale" default="stroke" type="tns:scale" use="optional" />
        <xs:attribute name="stroke" default="#00000000" type="tns:color" use="optional" />
        <xs:attribute name="stroke-width" default="0" type="tns:nonNegativeFloat" use="optional" />
        <xs:attribute name="text-transform" default="none" type="tns:textTransform" use="optional" />
    </xs:complexType>

    <xs:complexType name="caption">
        <xs:attribute name="cat" type="xs:string" use="optional" />
        <xs:attribute name="priority" default="0" type="xs:integer" use="optional" />
        <xs:attribute name="k" type="xs:string" use="required" />
        <xs:attribute name="display" default="ifspace" type="tns:display" use="optional" />
        <xs:attribute name="dy" default="0" type="xs:float" use="optional" />
        <xs:attribute name="font-family" default="default" type="tns:fontFamily" use="optional" />
        <xs:attribute name="font-style" default="normal" type="tns:fontStyle" use="optional" />
        <xs:attribute name="font-size" default="0" type="tns:nonNegativeFloat" use="optional" />
        <xs:attribute name="fill" default="#000000" type="tns:color" use="optional" />
        <xs:attribute name="stroke" default="#000000" type="tns:color" use="optional" />
        <xs:attribute name="stroke-width" default="0" type="tns:nonNegativeFloat" use="optional" />
        <xs:attribute name="position" default="auto" type="tns:position" use="optional" />
        <xs:attribute name="symbol-id" type="xs:string" use="optional" />
        <xs:attribute name="text-transform" default="none" type="tns:textTransform" use="optional" />
        <xs:attribute name="text-wrap-width" default="0" type="xs:integer" use="optional" />
    </xs:complexType>

    <!-- style menu cat element -->
    <xs:complexType name="cat">
        <xs:attribute name="id" type="xs:string" use="required" />
    </xs:complexType>

    <xs:complexType name="circle">
        <xs:attribute name="cat" type="xs:string" use="optional" />
        <xs:attribute name="radius" type="tns:nonNegativeFloat" use="required" />
        <xs:attribute name="scale-radius" default="false" type="xs:boolean" use="optional" />
        <xs:attribute name="fill" default="#00000000" type="tns:color" use="optional" />
        <xs:attribute name="stroke" default="#00000000" type="tns:color" use="optional" />
        <xs:attribute name="stroke-width" default="0" type="tns:nonNegativeFloat" use="optional" />
    </xs:complexType>

    <!-- style menu layer element -->
    <xs:complexType name="layer">
        <xs:sequence maxOccurs="1" minOccurs="0">
            <xs:element name="name" maxOccurs="unbounded" minOccurs="0" type="tns:name" />
            <xs:element name="cat" maxOccurs="unbounded" minOccurs="0" type="tns:cat" />
            <xs:element name="overlay" maxOccurs="unbounded" minOccurs="0" type="tns:overlay" />
        </xs:sequence>
        <xs:attribute name="id" type="xs:string" use="required" />
        <xs:attribute name="parent" type="xs:string" use="optional" />
        <xs:attribute name="visible" default="false" type="xs:boolean" use="optional" />
        <xs:attribute name="enabled" default="false" type="xs:boolean" use="optional" />
    </xs:complexType>

    <xs:complexType name="line">
        <xs:attribute name="cat" type="xs:string" use="optional" />
        <xs:attribute name="src" type="tns:src" use="optional" />
        <xs:attribute name="symbol-width" type="xs:positiveInteger" use="optional" />
        <xs:attribute name="symbol-height" type="xs:positiveInteger" use="optional" />
        <xs:attribute name="symbol-percent" type="xs:positiveInteger" use="optional" />
        <xs:attribute name="dy" default="0" type="xs:float" use="optional" />
        <xs:attribute name="scale" default="stroke" type="tns:scale" use="optional" />
        <xs:attribute name="stroke" default="#000000" type="tns:color" use="optional" />
        <xs:attribute name="stroke-width" default="0" type="tns:nonNegativeFloat" use="optional" />
        <xs:attribute name="stroke-dasharray" type="tns:strokeDasharray" use="optional" />
        <xs:attribute name="stroke-linecap" default="round" type="tns:cap" use="optional" />
        <xs:attribute name="stroke-linejoin" default="round" type="tns:linejoin" use="optional" />
        <xs:attribute name="curve" default="no" type="tns:curve" use="optional" />
    </xs:complexType>

    <xs:complexType name="lineSymbol">
        <xs:attribute name="cat" type="xs:string" use="optional" />
        <xs:attribute name="display" default="ifspace" type="tns:display" use="optional" />
        <xs:attribute name="dy" default="0" type="xs:float" use="optional" />
        <xs:attribute name="scale" default="stroke" type="tns:scale" use="optional" />
        <xs:attribute name="src" type="tns:src" use="required" />
        <xs:attribute name="symbol-width" type="xs:positiveInteger" use="optional" />
        <xs:attribute name="symbol-height" type="xs:positiveInteger" use="optional" />
        <xs:attribute name="symbol-percent" type="xs:positiveInteger" use="optional" />
        <xs:attribute name="symbol-orientation" default="right" type="tns:symbolOrientation" use="optional" />
        <xs:attribute name="position" default="below_right" type="tns:position" use="optional" />
        <xs:attribute name="priority" default="0" type="xs:integer" use="optional" />
        <xs:attribute name="repeat" default="false" type="xs:boolean" use="optional" />
        <xs:attribute name="repeat-gap" default="200" type="xs:float" use="optional" />
        <xs:attribute name="repeat-start" default="30" type="xs:float" use="optional" />
        <xs:attribute name="rotate" default="true" type="xs:boolean" use="optional" />
    </xs:complexType>

    <!-- style menu name element -->
    <xs:complexType name="name">
        <xs:attribute name="lang" type="xs:string" use="required" />
        <xs:attribute name="value" type="xs:string" use="required" />
    </xs:complexType>

    <!-- style menu overlay element -->
    <xs:complexType name="overlay">
        <xs:attribute name="id" type="xs:string" use="required" />
    </xs:complexType>

    <xs:complexType name="pathText">
        <xs:attribute name="cat" type="xs:string" use="optional" />
        <xs:attribute name="display" default="ifspace" type="tns:display" use="optional" />
        <xs:attribute name="k" type="xs:string" use="required" />
        <xs:attribute name="dy" default="0" type="xs:float" use="optional" />
        <xs:attribute name="font-family" default="default" type="tns:fontFamily" use="optional" />
        <xs:attribute name="font-style" default="normal" type="tns:fontStyle" use="optional" />
        <xs:attribute name="font-size" default="0" type="tns:nonNegativeFloat" use="optional" />
        <xs:attribute name="fill" default="#000000" type="tns:color" use="optional" />
        <xs:attribute name="priority" default="0" type="xs:integer" use="optional" />
        <xs:attribute name="scale" default="stroke" type="tns:scale" use="optional" />
        <xs:attribute name="stroke" default="#000000" type="tns:color" use="optional" />
        <xs:attribute name="stroke-width" default="0" type="tns:nonNegativeFloat" use="optional" />
        <xs:attribute name="repeat" default="true" type="xs:boolean" use="optional" />
        <xs:attribute name="repeat-gap" default="100" type="xs:float" use="optional" />
        <xs:attribute name="repeat-start" default="10" type="xs:float" use="optional" />
        <xs:attribute name="rotate" default="true" type="xs:boolean" use="optional" />
        <xs:attribute name="text-orientation" default="auto" type="tns:textOrientation" use="optional" />
        <xs:attribute name="text-transform" default="none" type="tns:textTransform" use="optional" />
    </xs:complexType>

    <xs:complexType name="symbol">
        <xs:attribute name="id" type="xs:string" use="optional" />
        <xs:attribute name="cat" type="xs:string" use="optional" />
        <xs:attribute name="display" default="ifspace" type="tns:display" use="optional" />
        <xs:attribute name="priority" default="0" type="xs:integer" use="optional" />
        <xs:attribute name="src" type="tns:src" use="required" />
        <xs:attribute name="symbol-width" type="xs:positiveInteger" use="optional" />
        <xs:attribute name="symbol-height" type="xs:positiveInteger" use="optional" />
        <xs:attribute name="symbol-percent" type="xs:positiveInteger" use="optional" />
        <xs:attribute name="position" default="center" type="tns:position" use="optional" />
    </xs:complexType>

    <!-- rule elements -->
    <xs:complexType name="rule">
        <xs:choice maxOccurs="unbounded" minOccurs="0">
            <!-- recursion to allow for nested rules -->
            <xs:element name="rule" type="tns:rule" />
            <xs:element name="area" type="tns:area" />
            <xs:element name="caption" type="tns:caption" />
            <xs:element name="circle" type="tns:circle" />
            <xs:element name="line" type="tns:line" />
            <xs:element name="lineSymbol" type="tns:lineSymbol" />
            <xs:element name="pathText" type="tns:pathText" />
            <xs:element name="symbol" type="tns:symbol" />
        </xs:choice>
        <xs:attribute name="e" type="tns:elementList" use="required" />
        <xs:attribute name="k" type="xs:string" use="required" />
        <xs:attribute name="v" type="xs:string" use="required" />
        <xs:attribute name="cat" type="xs:string" use="optional" />
        <xs:attribute name="closed" default="any" type="tns:closed" use="optional" />
        <xs:attribute name="zoom-min" default="0" type="xs:unsignedByte" use="optional" />
        <xs:attribute name="zoom-max" default="127" type="xs:unsignedByte" use="optional" />
    </xs:complexType>

    <!-- hillshading element -->
    <xs:complexType name="hillShading">
        <xs:attribute name="cat" type="xs:string" use="optional" />
        <xs:attribute name="zoom-min" default="9" type="xs:unsignedByte" use="optional" />
        <xs:attribute name="zoom-max" default="17" type="xs:unsignedByte" use="optional" />
        <xs:attribute name="magnitude" default="128" type="xs:unsignedByte" use="optional" />
        <xs:attribute name="color" default="#ff000000" type="tns:color" use="optional">
            <xs:annotation>
                <xs:documentation>Hill shading color. The alpha component is combined with the
                    "magnitude" attribute - you can use both to control the opacity of the hill
                    shading. They are multiplied, so for example a magnitude of 128 and a color of
                    #ff000000 would result in an opacity of 50%, while a magnitude of 128 and a
                    color of #80000000 would result in an opacity of 25% (0.5 * 0.5 = 0.25).
                </xs:documentation>
            </xs:annotation>
        </xs:attribute>
        <!-- customization unlikely to make any sense -->
        <xs:attribute name="layer" default="5" type="xs:unsignedByte" use="optional" />
    </xs:complexType>

    <!-- rendertheme element -->
    <xs:complexType name="rendertheme">
        <xs:sequence maxOccurs="1" minOccurs="0">
            <xs:element name="stylemenu" maxOccurs="1" minOccurs="0" type="tns:stylemenu" />
            <xs:choice maxOccurs="unbounded" minOccurs="0">
                <xs:element name="hillshading" maxOccurs="1" minOccurs="0" type="tns:hillShading" />
                <xs:element name="rule" maxOccurs="unbounded" minOccurs="0" type="tns:rule" />
            </xs:choice>
        </xs:sequence>
        <xs:attribute name="version" fixed="5" type="xs:positiveInteger" />
        <xs:attribute name="map-background" default="#ffffff" type="tns:color" use="optional" />
        <xs:attribute name="map-background-outside" default="#ffffff" type="tns:color" use="optional" />
        <xs:attribute name="base-stroke-width" default="1" type="tns:nonNegativeFloat" use="optional" />
        <xs:attribute name="base-text-size" default="1" type="tns:nonNegativeFloat" use="optional" />
    </xs:complexType>

    <!-- stylemenu element -->
    <xs:complexType name="stylemenu">
        <xs:sequence maxOccurs="1" minOccurs="0">
            <xs:element name="layer" maxOccurs="unbounded" minOccurs="0" type="tns:layer" />
        </xs:sequence>
        <xs:attribute name="defaultvalue" type="xs:string" use="required" />
        <xs:attribute name="defaultlang" type="xs:string" use="required" />
        <xs:attribute name="id" type="xs:string" use="required" />
    </xs:complexType>

    <!-- root element -->
    <xs:element name="rendertheme" type="tns:rendertheme" />

</xs:schema>
